{
  "schemaVersion": "1.0.0",
  "idempotencyKey": "batch.preview.001",
  "sourceManifestId": "manifest.synthetic.approved",
  "sourceManifestContentHash": "sha256:aaaaaaaaaaaaaaaaaaaaaaaaaaaaaaaaaaaaaaaaaaaaaaaaaaaaaaaaaaaaaaaa",
  "targetTier": "preview_fast",
  "shotIds": [
    "shot.001",
    "shot.002"
  ],
  "sourcePreviewBatchRef": null
}
